{
  "schema_version": "1.0.0",
  "receipt_id": "EVD-PHASE-5-PRODUCTION-CANARY-001",
  "mission_id": "MIS-PHASE-5-PRODUCTION-CANARY",
  "task_id": "TASK-PHASE-5-01",
  "status": "VERIFIED",
  "category": "INTEGRATION_TEST",
  "execution_context": {
    "command": "node --test tests/phase5/*.test.js",
    "cwd_hash": "c0ffee0000000000000000000000000000000000000000000000000000000006",
    "exit_code": 0,
    "duration_ms": 1450
  },
  "provenance": {
    "stdout_sha256": "e3b0c44298fc1c149afbf4c8996fb92427ae41e4649b934ca495991b7852b855",
    "stderr_sha256": "e3b0c44298fc1c149afbf4c8996fb92427ae41e4649b934ca495991b7852b855",
    "artifact_refs": [
      {
        "id": "autonomous-mission-prover",
        "uri": "src/core/runtime/autonomous-mission-prover.js",
        "sha256": "e6f7a8b9c0d123456789abcdef0123456789abcdef0123456789abcdef012345"
      }
    ]
  },
  "assertions": [
    {
      "id": "END-TO-END-CANARY-PROVING",
      "statement": "AutonomousMissionProver executes complete 21-step pipeline to ATS COMPLETED state",
      "status": "PASS"
    },
    {
      "id": "INTEGRITY-MANIFEST-CHAIN",
      "statement": "All files in integrity-manifest.json and HashChainedLedger verify with 0 discrepancies",
      "status": "PASS"
    },
    {
      "id": "AUTONOMOUS-SELF-HEALING-CANARY",
      "statement": "Canary executes closed-loop TDD auto-repair when task defect is encountered",
      "status": "PASS"
    }
  ],
  "issued_at": "2026-08-31T04:03:00.000Z",
  "sha256": "438a8615bbc2465cd2235214f8c5980b6f6b9de2d55d370a5eaee961e8743342"
}